{
  "$schema": "../../../schemas/kit-security-checks.schema.json",
  "schema_version": "2.0.0",
  "kit_slug": "rust-actix-postgresql",
  "updated_at": "2026-10-24",
  "owasp_edition": "2025",
  "summary": {
    "total": 12,
    "categories": 4,
    "by_status": {
      "enforced": 12
    },
    "by_severity": {
      "critical": 4,
      "high": 2,
      "medium": 5,
      "low": 1
    },
    "owasp_covered": [
      "A02:2025",
      "A04:2025",
      "A05:2025",
      "A06:2025",
      "A08:2025",
      "A10:2025"
    ]
  },
  "checks": [
    {
      "id": "RUST-01",
      "category": "Memory Safety & Zero-Trust Rust Compiler Defenses",
      "name": "Zero unsafe code policy enforced via #![deny(unsafe_code)]",
      "status": "enforced",
      "severity": "critical",
      "owasp": [
        "A05:2025"
      ],
      "cwe": [
        "CWE-119"
      ],
      "evidence": {
        "kind": "rule",
        "path": "rules/source/01-framework-architecture-and-standards.md"
      }
    },
    {
      "id": "RUST-02",
      "category": "Memory Safety & Zero-Trust Rust Compiler Defenses",
      "name": "Strict Serde JSON deserialization with input length bounds and validator crate",
      "status": "enforced",
      "severity": "critical",
      "owasp": [
        "A08:2025"
      ],
      "cwe": [
        "CWE-502"
      ],
      "evidence": {
        "kind": "test",
        "path": "starter/src/dtos.rs"
      }
    },
    {
      "id": "RUST-03",
      "category": "Memory Safety & Zero-Trust Rust Compiler Defenses",
      "name": "SeaORM parameterized queries eliminating SQL injection vulnerabilities",
      "status": "enforced",
      "severity": "critical",
      "owasp": [
        "A05:2025"
      ],
      "cwe": [
        "CWE-89"
      ],
      "evidence": {
        "kind": "tool",
        "path": "sea-orm"
      }
    },
    {
      "id": "DB-01",
      "category": "Database Hardening & Connection Protection",
      "name": "Bounded connection pool limits via ConnectOptions (max 25 connections)",
      "status": "enforced",
      "severity": "medium",
      "owasp": [
        "A06:2025"
      ],
      "cwe": [
        "CWE-400"
      ],
      "evidence": {
        "kind": "rule",
        "path": "rules/source/02-seaorm-entities-and-postgresql-pooling.md"
      }
    },
    {
      "id": "DB-02",
      "category": "Database Hardening & Connection Protection",
      "name": "Strict acquire timeout (3s) preventing connection starvation deadlocks",
      "status": "enforced",
      "severity": "medium",
      "owasp": [
        "A06:2025"
      ],
      "cwe": [
        "CWE-400"
      ],
      "evidence": {
        "kind": "rule",
        "path": "rules/source/02-seaorm-entities-and-postgresql-pooling.md"
      }
    },
    {
      "id": "DB-03",
      "category": "Database Hardening & Connection Protection",
      "name": "Atomic transaction encapsulation via db.transaction for ACID guarantees",
      "status": "enforced",
      "severity": "medium",
      "owasp": [
        "A08:2025"
      ],
      "cwe": [
        "CWE-662"
      ],
      "evidence": {
        "kind": "rule",
        "path": "rules/source/02-seaorm-entities-and-postgresql-pooling.md"
      }
    },
    {
      "id": "NET-01",
      "category": "Network & Middleware Security Layers",
      "name": "Strict CORS origin whitelist parsed from ALLOWED_ORIGINS (no wildcard *)",
      "status": "enforced",
      "severity": "high",
      "owasp": [
        "A02:2025"
      ],
      "cwe": [
        "CWE-942"
      ],
      "evidence": {
        "kind": "test",
        "path": "starter/src/lib.rs"
      }
    },
    {
      "id": "NET-02",
      "category": "Network & Middleware Security Layers",
      "name": "Unified AppError boundary preventing database schema disclosure",
      "status": "enforced",
      "severity": "medium",
      "owasp": [
        "A10:2025"
      ],
      "cwe": [
        "CWE-755"
      ],
      "evidence": {
        "kind": "test",
        "path": "starter/src/errors.rs"
      }
    },
    {
      "id": "NET-03",
      "category": "Network & Middleware Security Layers",
      "name": "Pagination bounds enforcement (clamp 1..100) preventing query DoS",
      "status": "enforced",
      "severity": "medium",
      "owasp": [
        "A06:2025"
      ],
      "cwe": [
        "CWE-770"
      ],
      "evidence": {
        "kind": "test",
        "path": "starter/src/handlers.rs"
      }
    },
    {
      "id": "OPS-01",
      "category": "Container & Supply Chain Hardening",
      "name": "Liveness probe health endpoint (/healthz) returning HTTP 200 OK",
      "status": "enforced",
      "severity": "low",
      "owasp": [
        "A10:2025"
      ],
      "cwe": [
        "CWE-755"
      ],
      "evidence": {
        "kind": "endpoint",
        "path": "GET /healthz"
      }
    },
    {
      "id": "OPS-02",
      "category": "Container & Supply Chain Hardening",
      "name": "Non-root execution inside multi-stage Alpine container (USER 10001:10001)",
      "status": "enforced",
      "severity": "high",
      "owasp": [
        "A02:2025"
      ],
      "cwe": [
        "CWE-250"
      ],
      "evidence": {
        "kind": "docker",
        "path": "starter/Dockerfile"
      }
    },
    {
      "id": "OPS-03",
      "category": "Container & Supply Chain Hardening",
      "name": "Gitleaks secret detection and cargo-audit dependency scanning in CI",
      "status": "enforced",
      "severity": "critical",
      "owasp": [
        "A04:2025"
      ],
      "cwe": [
        "CWE-798"
      ],
      "evidence": {
        "kind": "workflow",
        "path": ".github/workflows/validate-kits.yml"
      }
    }
  ]
}
