{
  "$schema": "../../../schemas/kit-security-checks.schema.json",
  "schema_version": "2.0.0",
  "kit_slug": "nextjs-prisma-postgresql",
  "updated_at": "2026-10-22",
  "owasp_edition": "2025",
  "summary": {
    "total": 14,
    "categories": 1,
    "by_status": {
      "enforced": 14
    },
    "by_severity": {
      "critical": 3,
      "high": 8,
      "medium": 3
    },
    "owasp_covered": [
      "A01:2025",
      "A02:2025",
      "A03:2025",
      "A04:2025",
      "A05:2025",
      "A06:2025",
      "A07:2025",
      "A08:2025"
    ]
  },
  "checks": [
    {
      "id": "SEC-01",
      "category": "Core Security Guardrails",
      "name": "Zero Plaintext Credentials",
      "status": "enforced",
      "severity": "critical",
      "owasp": [
        "A04:2025"
      ],
      "description": "Database connection URL and secrets managed via .env.",
      "cwe": [
        "CWE-798"
      ],
      "evidence": {
        "kind": "test",
        "path": "starter/tests/security.test.ts"
      }
    },
    {
      "id": "SEC-02",
      "category": "Core Security Guardrails",
      "name": "Rootless Container Isolation",
      "status": "enforced",
      "severity": "high",
      "owasp": [
        "A02:2025"
      ],
      "description": "Dockerfile specifies non-root USER 10001:10001.",
      "cwe": [
        "CWE-250"
      ],
      "evidence": {
        "kind": "test",
        "path": "starter/tests/security.test.ts"
      }
    },
    {
      "id": "SEC-03",
      "category": "Core Security Guardrails",
      "name": "Parameterized Prisma Queries",
      "status": "enforced",
      "severity": "critical",
      "owasp": [
        "A05:2025"
      ],
      "description": "All database operations use typed Prisma client or parameterized raw queries.",
      "cwe": [
        "CWE-89"
      ],
      "evidence": {
        "kind": "test",
        "path": "starter/tests/security.test.ts"
      }
    },
    {
      "id": "SEC-04",
      "category": "Core Security Guardrails",
      "name": "Runtime Zod Schema Validation",
      "status": "enforced",
      "severity": "high",
      "owasp": [
        "A05:2025"
      ],
      "description": "Server Actions validate all input parameters against strict Zod schemas.",
      "cwe": [
        "CWE-20"
      ],
      "evidence": {
        "kind": "test",
        "path": "starter/tests/security.test.ts"
      }
    },
    {
      "id": "SEC-05",
      "category": "Core Security Guardrails",
      "name": "Multi-Tenant Isolation Constraints",
      "status": "enforced",
      "severity": "high",
      "owasp": [
        "A07:2025"
      ],
      "description": "All data queries scope records by authenticated tenantId.",
      "cwe": [
        "CWE-287"
      ],
      "evidence": {
        "kind": "test",
        "path": "starter/tests/security.test.ts"
      }
    },
    {
      "id": "SEC-06",
      "category": "Core Security Guardrails",
      "name": "Connection Pool Saturation Defense",
      "status": "enforced",
      "severity": "medium",
      "owasp": [
        "A06:2025"
      ],
      "description": "PrismaClient singleton prevents connection leaks across hot reloads.",
      "cwe": [
        "CWE-400"
      ],
      "evidence": {
        "kind": "test",
        "path": "starter/tests/security.test.ts"
      }
    },
    {
      "id": "SEC-07",
      "category": "Core Security Guardrails",
      "name": "CSRF & Origin Header Enforcement",
      "status": "enforced",
      "severity": "high",
      "owasp": [
        "A07:2025"
      ],
      "description": "Next.js 15 Server Action built-in host/origin verification active.",
      "cwe": [
        "CWE-294"
      ],
      "evidence": {
        "kind": "test",
        "path": "starter/tests/security.test.ts"
      }
    },
    {
      "id": "SEC-08",
      "category": "Core Security Guardrails",
      "name": "Session Cookie Hardening",
      "status": "enforced",
      "severity": "high",
      "owasp": [
        "A07:2025"
      ],
      "description": "SameSite=Lax, HttpOnly, and Secure cookie flags enforced.",
      "cwe": [
        "CWE-1004"
      ],
      "evidence": {
        "kind": "test",
        "path": "starter/tests/security.test.ts"
      }
    },
    {
      "id": "SEC-09",
      "category": "Core Security Guardrails",
      "name": "XSS Output Escaping",
      "status": "enforced",
      "severity": "high",
      "owasp": [
        "A05:2025"
      ],
      "description": "React JSX auto-escaping prevents cross-site scripting vulnerabilities.",
      "cwe": [
        "CWE-79"
      ],
      "evidence": {
        "kind": "test",
        "path": "starter/tests/security.test.ts"
      }
    },
    {
      "id": "SEC-10",
      "category": "Core Security Guardrails",
      "name": "Rate Limiting on Mutating Actions",
      "status": "enforced",
      "severity": "high",
      "owasp": [
        "A06:2025"
      ],
      "description": "Sliding-window IP and user rate limiting on creation actions.",
      "cwe": [
        "CWE-770"
      ],
      "evidence": {
        "kind": "test",
        "path": "starter/tests/security.test.ts"
      }
    },
    {
      "id": "SEC-11",
      "category": "Core Security Guardrails",
      "name": "Atomic Database Transactions",
      "status": "enforced",
      "severity": "medium",
      "owasp": [
        "A08:2025"
      ],
      "description": "Multi-entity mutations wrapped in prisma.$transaction blocks.",
      "cwe": [
        "CWE-662"
      ],
      "evidence": {
        "kind": "test",
        "path": "starter/tests/security.test.ts"
      }
    },
    {
      "id": "SEC-12",
      "category": "Core Security Guardrails",
      "name": "Mass Assignment Prevention",
      "status": "enforced",
      "severity": "high",
      "owasp": [
        "A01:2025"
      ],
      "description": "Explicit DTO fields selected in Prisma create/update payloads.",
      "cwe": [
        "CWE-915"
      ],
      "evidence": {
        "kind": "test",
        "path": "starter/tests/security.test.ts"
      }
    },
    {
      "id": "SEC-13",
      "category": "Core Security Guardrails",
      "name": "SAST Semgrep OSS Scan",
      "status": "enforced",
      "severity": "medium",
      "owasp": [
        "A03:2025"
      ],
      "description": "0 blocking findings on OWASP Top 10 ruleset.",
      "cwe": [
        "CWE-1357"
      ],
      "evidence": {
        "kind": "test",
        "path": "starter/tests/security.test.ts"
      }
    },
    {
      "id": "SEC-14",
      "category": "Core Security Guardrails",
      "name": "Gitleaks Secret Scan",
      "status": "enforced",
      "severity": "critical",
      "owasp": [
        "A04:2025"
      ],
      "description": "0 leaked tokens or credentials detected.",
      "cwe": [
        "CWE-798"
      ],
      "evidence": {
        "kind": "test",
        "path": "starter/tests/security.test.ts"
      }
    }
  ]
}
