{
  "$schema": "../../../schemas/kit-security-checks.schema.json",
  "schema_version": "2.0.0",
  "kit_slug": "elixir-phoenix-liveview",
  "updated_at": "2026-10-24",
  "owasp_edition": "2025",
  "summary": {
    "total": 12,
    "categories": 1,
    "by_status": {
      "enforced": 12
    },
    "by_severity": {
      "critical": 2,
      "high": 6,
      "medium": 4
    },
    "owasp_covered": [
      "A01:2025",
      "A02:2025",
      "A03:2025",
      "A04:2025",
      "A05:2025",
      "A06:2025",
      "A07:2025",
      "A08:2025"
    ]
  },
  "checks": [
    {
      "id": "SEC-01",
      "category": "Core Security Guardrails",
      "name": "Gitleaks Secret Audit",
      "status": "enforced",
      "severity": "critical",
      "owasp": [
        "A04:2025"
      ],
      "cwe": [
        "CWE-798"
      ],
      "evidence": {
        "kind": "tool",
        "path": "gitleaks"
      }
    },
    {
      "id": "SEC-02",
      "category": "Core Security Guardrails",
      "name": "Sobelow Static Security Analysis",
      "status": "enforced",
      "severity": "medium",
      "owasp": [
        "A03:2025"
      ],
      "cwe": [
        "CWE-1357"
      ],
      "evidence": {
        "kind": "tool",
        "path": "sobelow"
      }
    },
    {
      "id": "SEC-03",
      "category": "Core Security Guardrails",
      "name": "LiveView CSRF Token Handshake",
      "status": "enforced",
      "severity": "high",
      "owasp": [
        "A06:2025"
      ],
      "cwe": [
        "CWE-352"
      ],
      "evidence": {
        "kind": "tool",
        "path": "phoenix-csrf"
      }
    },
    {
      "id": "SEC-04",
      "category": "Core Security Guardrails",
      "name": "Ecto Changeset Parameter Filtering",
      "status": "enforced",
      "severity": "high",
      "owasp": [
        "A01:2025"
      ],
      "cwe": [
        "CWE-915"
      ],
      "evidence": {
        "kind": "tool",
        "path": "ecto-guard"
      }
    },
    {
      "id": "SEC-05",
      "category": "Core Security Guardrails",
      "name": "Parameterized PostgreSQL Query Enforcement",
      "status": "enforced",
      "severity": "critical",
      "owasp": [
        "A05:2025"
      ],
      "cwe": [
        "CWE-89"
      ],
      "evidence": {
        "kind": "tool",
        "path": "postgrex"
      }
    },
    {
      "id": "SEC-06",
      "category": "Core Security Guardrails",
      "name": "WebSocket Connection Origin Validation",
      "status": "enforced",
      "severity": "high",
      "owasp": [
        "A05:2025"
      ],
      "cwe": [
        "CWE-20"
      ],
      "evidence": {
        "kind": "tool",
        "path": "endpoint-check"
      }
    },
    {
      "id": "SEC-07",
      "category": "Core Security Guardrails",
      "name": "BEAM Process Supervisor Isolation",
      "status": "enforced",
      "severity": "medium",
      "owasp": [
        "A06:2025"
      ],
      "cwe": [
        "CWE-662"
      ],
      "evidence": {
        "kind": "tool",
        "path": "otp-supervisor"
      }
    },
    {
      "id": "SEC-08",
      "category": "Core Security Guardrails",
      "name": "Content Security Policy (put_secure_browser_headers)",
      "status": "enforced",
      "severity": "medium",
      "owasp": [
        "A02:2025"
      ],
      "cwe": [
        "CWE-693"
      ],
      "evidence": {
        "kind": "tool",
        "path": "router-lint"
      }
    },
    {
      "id": "SEC-09",
      "category": "Core Security Guardrails",
      "name": "Session Cookie Protection (HttpOnly, SameSite=Lax)",
      "status": "enforced",
      "severity": "high",
      "owasp": [
        "A07:2025"
      ],
      "cwe": [
        "CWE-1004"
      ],
      "evidence": {
        "kind": "tool",
        "path": "cookie-lint"
      }
    },
    {
      "id": "SEC-10",
      "category": "Core Security Guardrails",
      "name": "Ecto PostgreSQL Constraint Migrations",
      "status": "enforced",
      "severity": "medium",
      "owasp": [
        "A08:2025"
      ],
      "cwe": [
        "CWE-1059"
      ],
      "evidence": {
        "kind": "tool",
        "path": "migration-check"
      }
    },
    {
      "id": "SEC-11",
      "category": "Core Security Guardrails",
      "name": "PubSub Topic Injection Prevention",
      "status": "enforced",
      "severity": "high",
      "owasp": [
        "A05:2025"
      ],
      "cwe": [
        "CWE-74"
      ],
      "evidence": {
        "kind": "tool",
        "path": "pubsub-lint"
      }
    },
    {
      "id": "SEC-12",
      "category": "Core Security Guardrails",
      "name": "Hex Package Vulnerability Audit (mix hex.audit)",
      "status": "enforced",
      "severity": "high",
      "owasp": [
        "A03:2025"
      ],
      "cwe": [
        "CWE-1104"
      ],
      "evidence": {
        "kind": "tool",
        "path": "hex-audit"
      }
    }
  ]
}
