{
  "$schema": "../../../schemas/kit-security-checks.schema.json",
  "schema_version": "2.0.0",
  "kit_slug": "security-llm-guardrails",
  "updated_at": "2026-10-24",
  "owasp_edition": "2025",
  "summary": {
    "total": 12,
    "categories": 1,
    "by_status": {
      "enforced": 12
    },
    "by_severity": {
      "critical": 3,
      "high": 6,
      "medium": 1,
      "low": 2
    },
    "owasp_covered": [
      "A02:2025",
      "A03:2025",
      "A04:2025",
      "A05:2025",
      "A06:2025",
      "A10:2025"
    ]
  },
  "checks": [
    {
      "id": "SEC-01",
      "category": "Core Security Guardrails",
      "name": "Gitleaks Secret Audit",
      "status": "enforced",
      "severity": "critical",
      "owasp": [
        "A04:2025"
      ],
      "cwe": [
        "CWE-798"
      ],
      "evidence": {
        "kind": "tool",
        "path": "gitleaks"
      }
    },
    {
      "id": "SEC-02",
      "category": "Core Security Guardrails",
      "name": "Semgrep SAST Python Code Scan",
      "status": "enforced",
      "severity": "medium",
      "owasp": [
        "A03:2025"
      ],
      "cwe": [
        "CWE-1357"
      ],
      "evidence": {
        "kind": "tool",
        "path": "semgrep"
      }
    },
    {
      "id": "SEC-03",
      "category": "Core Security Guardrails",
      "name": "Explicit CORS Policy (Zero Wildcard Origins)",
      "status": "enforced",
      "severity": "high",
      "owasp": [
        "A02:2025"
      ],
      "cwe": [
        "CWE-942"
      ],
      "evidence": {
        "kind": "tool",
        "path": "code-lint"
      }
    },
    {
      "id": "SEC-04",
      "category": "Core Security Guardrails",
      "name": "Prompt Injection & Jailbreak Heuristic Interception",
      "status": "enforced",
      "severity": "critical",
      "owasp": [
        "A05:2025"
      ],
      "cwe": [
        "CWE-1427"
      ],
      "evidence": {
        "kind": "tool",
        "path": "static-analysis"
      }
    },
    {
      "id": "SEC-05",
      "category": "Core Security Guardrails",
      "name": "Automated PII Anonymization & Reversible Masking",
      "status": "enforced",
      "severity": "high",
      "owasp": [
        "A06:2025"
      ],
      "cwe": [
        "CWE-359"
      ],
      "evidence": {
        "kind": "tool",
        "path": "static-analysis"
      }
    },
    {
      "id": "SEC-06",
      "category": "Core Security Guardrails",
      "name": "Non-Root Container Execution (UID 10001)",
      "status": "enforced",
      "severity": "high",
      "owasp": [
        "A02:2025"
      ],
      "cwe": [
        "CWE-250"
      ],
      "evidence": {
        "kind": "tool",
        "path": "docker-lint"
      }
    },
    {
      "id": "SEC-07",
      "category": "Core Security Guardrails",
      "name": "Health Probe & Gateway Status Endpoint",
      "status": "enforced",
      "severity": "low",
      "owasp": [
        "A10:2025"
      ],
      "cwe": [
        "CWE-755"
      ],
      "evidence": {
        "kind": "tool",
        "path": "test-runner"
      }
    },
    {
      "id": "SEC-08",
      "category": "Core Security Guardrails",
      "name": "Denial of Wallet Token & Cost Rate Limiting",
      "status": "enforced",
      "severity": "high",
      "owasp": [
        "A06:2025"
      ],
      "cwe": [
        "CWE-770"
      ],
      "evidence": {
        "kind": "tool",
        "path": "quota-audit"
      }
    },
    {
      "id": "SEC-09",
      "category": "Core Security Guardrails",
      "name": "Delimiter Sandboxing & XML Boundary Isolation",
      "status": "enforced",
      "severity": "high",
      "owasp": [
        "A06:2025"
      ],
      "cwe": [
        "CWE-653"
      ],
      "evidence": {
        "kind": "tool",
        "path": "static-analysis"
      }
    },
    {
      "id": "SEC-10",
      "category": "Core Security Guardrails",
      "name": "Canary Token System Prompt Leakage Protection",
      "status": "enforced",
      "severity": "critical",
      "owasp": [
        "A05:2025"
      ],
      "cwe": [
        "CWE-1427"
      ],
      "evidence": {
        "kind": "tool",
        "path": "static-analysis"
      }
    },
    {
      "id": "SEC-11",
      "category": "Core Security Guardrails",
      "name": "Pydantic AI Strict Output Schema Validation",
      "status": "enforced",
      "severity": "high",
      "owasp": [
        "A05:2025"
      ],
      "cwe": [
        "CWE-20"
      ],
      "evidence": {
        "kind": "tool",
        "path": "schema-linter"
      }
    },
    {
      "id": "SEC-12",
      "category": "Core Security Guardrails",
      "name": "Token-Light Efficiency Verification (Tier A+ Standard)",
      "status": "enforced",
      "severity": "low",
      "owasp": [
        "A06:2025"
      ],
      "cwe": [
        "CWE-1050"
      ],
      "evidence": {
        "kind": "tool",
        "path": "eval-runner"
      }
    }
  ]
}
