{
  "$schema": "../../../schemas/kit-security-checks.schema.json",
  "schema_version": "2.0.0",
  "kit_slug": "laravel-api-sanctum",
  "updated_at": "2026-10-24",
  "owasp_edition": "2025",
  "summary": {
    "total": 14,
    "categories": 12,
    "by_status": {
      "enforced": 14
    },
    "by_severity": {
      "critical": 2,
      "high": 11,
      "medium": 1
    },
    "owasp_covered": [
      "A01:2025",
      "A02:2025",
      "A04:2025",
      "A05:2025",
      "A06:2025",
      "A07:2025",
      "A08:2025"
    ]
  },
  "checks": [
    {
      "id": "SEC-01",
      "category": "Authentication",
      "name": "Stateless Sanctum Authentication Enforcement",
      "status": "enforced",
      "severity": "high",
      "owasp": [
        "A07:2025"
      ],
      "description": "All /api/v1/ routes (except /auth/login) must require auth:sanctum middleware.",
      "cwe": [
        "CWE-287"
      ],
      "evidence": {
        "kind": "test",
        "path": "starter/tests/Feature/SecurityControlsTest.php"
      }
    },
    {
      "id": "SEC-02",
      "category": "Authorization",
      "name": "BOLA / IDOR Model Policy Authorization",
      "status": "enforced",
      "severity": "critical",
      "owasp": [
        "A01:2025"
      ],
      "description": "Controller actions with route model binding must call $this->authorize('action', $model).",
      "cwe": [
        "CWE-639"
      ],
      "evidence": {
        "kind": "test",
        "path": "starter/tests/Feature/SecurityControlsTest.php"
      }
    },
    {
      "id": "SEC-03",
      "category": "Data Access",
      "name": "Tenant Isolation in Query Lists",
      "status": "enforced",
      "severity": "critical",
      "owasp": [
        "A01:2025"
      ],
      "description": "Index queries must filter by auth()->id() or tenant relationship.",
      "cwe": [
        "CWE-639"
      ],
      "evidence": {
        "kind": "test",
        "path": "starter/tests/Feature/SecurityControlsTest.php"
      }
    },
    {
      "id": "SEC-04",
      "category": "Authorization",
      "name": "Granular Token Ability Scopes",
      "status": "enforced",
      "severity": "high",
      "owasp": [
        "A07:2025"
      ],
      "description": "Mutating endpoints must enforce token abilities via ability middleware.",
      "cwe": [
        "CWE-287"
      ],
      "evidence": {
        "kind": "test",
        "path": "starter/tests/Feature/SecurityControlsTest.php"
      }
    },
    {
      "id": "SEC-05",
      "category": "Authentication",
      "name": "Token Expiration Configuration",
      "status": "enforced",
      "severity": "high",
      "owasp": [
        "A07:2025"
      ],
      "description": "Sanctum personal access tokens must have explicit expiration configured.",
      "cwe": [
        "CWE-287"
      ],
      "evidence": {
        "kind": "test",
        "path": "starter/tests/Feature/SecurityControlsTest.php"
      }
    },
    {
      "id": "SEC-06",
      "category": "Availability",
      "name": "API Rate Limiting Throttle Middleware",
      "status": "enforced",
      "severity": "high",
      "owasp": [
        "A07:2025"
      ],
      "description": "API endpoints must apply throttle:60,1 to prevent brute force and denial of service.",
      "cwe": [
        "CWE-307"
      ],
      "evidence": {
        "kind": "test",
        "path": "starter/tests/Feature/SecurityControlsTest.php"
      }
    },
    {
      "id": "SEC-07",
      "category": "Data Exposure",
      "name": "Strict Eloquent API Resource Serialization",
      "status": "enforced",
      "severity": "high",
      "owasp": [
        "A08:2025"
      ],
      "description": "Controllers must return API Resources rather than raw Eloquent models to prevent password/token leaks.",
      "cwe": [
        "CWE-502"
      ],
      "evidence": {
        "kind": "test",
        "path": "starter/tests/Feature/SecurityControlsTest.php"
      }
    },
    {
      "id": "SEC-08",
      "category": "SQL Injection / DoS",
      "name": "Spatie Allowed Filters Whitelist",
      "status": "enforced",
      "severity": "high",
      "owasp": [
        "A06:2025"
      ],
      "description": "Spatie QueryBuilder must explicitly whitelist allowedFilters and allowedSorts to prevent arbitrary column filtering.",
      "cwe": [
        "CWE-653"
      ],
      "evidence": {
        "kind": "test",
        "path": "starter/tests/Feature/SecurityControlsTest.php"
      }
    },
    {
      "id": "SEC-09",
      "category": "Container Security",
      "name": "Rootless Dockerfile Execution",
      "status": "enforced",
      "severity": "high",
      "owasp": [
        "A02:2025"
      ],
      "description": "Container process must execute as unprivileged user 10001:10001.",
      "cwe": [
        "CWE-250"
      ],
      "evidence": {
        "kind": "test",
        "path": "starter/tests/Feature/SecurityControlsTest.php"
      }
    },
    {
      "id": "SEC-10",
      "category": "Secret Management",
      "name": "No Secret Tokens in Source Code or VCS",
      "status": "enforced",
      "severity": "high",
      "owasp": [
        "A04:2025"
      ],
      "description": "Source code and git history must not contain unencrypted API keys or token hashes.",
      "cwe": [
        "CWE-311"
      ],
      "evidence": {
        "kind": "test",
        "path": "starter/tests/Feature/SecurityControlsTest.php"
      }
    },
    {
      "id": "SEC-11",
      "category": "Network Security",
      "name": "Strict CORS Configuration",
      "status": "enforced",
      "severity": "high",
      "owasp": [
        "A02:2025"
      ],
      "description": "CORS must restrict allowed origins and not use wildcard '*' with credentials.",
      "cwe": [
        "CWE-942"
      ],
      "evidence": {
        "kind": "test",
        "path": "starter/tests/Feature/SecurityControlsTest.php"
      }
    },
    {
      "id": "SEC-12",
      "category": "Input Validation",
      "name": "Form Request Validation with Typed Rules",
      "status": "enforced",
      "severity": "high",
      "owasp": [
        "A05:2025"
      ],
      "description": "All mutating requests must be validated through custom FormRequest classes.",
      "cwe": [
        "CWE-20"
      ],
      "evidence": {
        "kind": "test",
        "path": "starter/tests/Feature/SecurityControlsTest.php"
      }
    },
    {
      "id": "SEC-13",
      "category": "Architecture",
      "name": "CSRF Disabled on Stateless API Routes",
      "status": "enforced",
      "severity": "high",
      "owasp": [
        "A07:2025"
      ],
      "description": "Stateless API routes must not use CSRF cookies; Bearer tokens provide intrinsic CSRF immunity.",
      "cwe": [
        "CWE-287"
      ],
      "evidence": {
        "kind": "test",
        "path": "starter/tests/Feature/SecurityControlsTest.php"
      }
    },
    {
      "id": "SEC-14",
      "category": "Data Integrity",
      "name": "Database Transaction Wrapping for Compound Writes",
      "status": "enforced",
      "severity": "medium",
      "owasp": [
        "A08:2025"
      ],
      "description": "Operations updating multiple tables must execute inside DB::transaction().",
      "cwe": [
        "CWE-662"
      ],
      "evidence": {
        "kind": "test",
        "path": "starter/tests/Feature/SecurityControlsTest.php"
      }
    }
  ]
}
