{
  "$schema": "../../../schemas/kit-security-checks.schema.json",
  "schema_version": "2.0.0",
  "kit_slug": "ts-hono-bun-sqlite",
  "updated_at": "2026-10-24",
  "owasp_edition": "2025",
  "summary": {
    "total": 12,
    "categories": 4,
    "by_status": {
      "enforced": 12
    },
    "by_severity": {
      "critical": 2,
      "high": 5,
      "medium": 3,
      "low": 2
    },
    "owasp_covered": [
      "A01:2025",
      "A02:2025",
      "A04:2025",
      "A05:2025",
      "A06:2025",
      "A10:2025"
    ]
  },
  "checks": [
    {
      "id": "SQL-01",
      "category": "Database & Query Injection Defenses",
      "name": "Strict parameter binding via bun:sqlite prepared statements",
      "status": "enforced",
      "severity": "critical",
      "owasp": [
        "A05:2025"
      ],
      "cwe": [
        "CWE-89"
      ],
      "evidence": {
        "kind": "test",
        "path": "starter/src/index.ts"
      }
    },
    {
      "id": "SQL-02",
      "category": "Database & Query Injection Defenses",
      "name": "SQLite WAL mode and foreign key constraint enforcement",
      "status": "enforced",
      "severity": "medium",
      "owasp": [
        "A06:2025"
      ],
      "cwe": [
        "CWE-662"
      ],
      "evidence": {
        "kind": "test",
        "path": "starter/src/index.ts"
      }
    },
    {
      "id": "SQL-03",
      "category": "Database & Query Injection Defenses",
      "name": "Compound index coverage on sorted created_at timestamp columns",
      "status": "enforced",
      "severity": "low",
      "owasp": [
        "A06:2025"
      ],
      "cwe": [
        "CWE-1049"
      ],
      "evidence": {
        "kind": "test",
        "path": "starter/src/index.ts"
      }
    },
    {
      "id": "VAL-01",
      "category": "Request Validation & Mass Assignment Protection",
      "name": "Strict Zod schema validation on JSON request bodies",
      "status": "enforced",
      "severity": "high",
      "owasp": [
        "A05:2025"
      ],
      "cwe": [
        "CWE-20"
      ],
      "evidence": {
        "kind": "test",
        "path": "starter/src/index.test.ts"
      }
    },
    {
      "id": "VAL-02",
      "category": "Request Validation & Mass Assignment Protection",
      "name": "Rejection of extraneous properties (.strict()) preventing mass assignment",
      "status": "enforced",
      "severity": "high",
      "owasp": [
        "A01:2025"
      ],
      "cwe": [
        "CWE-915"
      ],
      "evidence": {
        "kind": "test",
        "path": "starter/src/index.test.ts"
      }
    },
    {
      "id": "VAL-03",
      "category": "Request Validation & Mass Assignment Protection",
      "name": "Enforced query pagination bounds (limit <= 100) preventing memory DoS",
      "status": "enforced",
      "severity": "medium",
      "owasp": [
        "A06:2025"
      ],
      "cwe": [
        "CWE-770"
      ],
      "evidence": {
        "kind": "test",
        "path": "starter/src/index.ts"
      }
    },
    {
      "id": "SEC-01",
      "category": "HTTP Security & Header Hardening",
      "name": "Hono secureHeaders middleware ensuring strict CSP, HSTS, X-Frame-Options",
      "status": "enforced",
      "severity": "high",
      "owasp": [
        "A04:2025"
      ],
      "cwe": [
        "CWE-319"
      ],
      "evidence": {
        "kind": "rule",
        "path": "rules/source/01-hono-framework-architecture.md"
      }
    },
    {
      "id": "SEC-02",
      "category": "HTTP Security & Header Hardening",
      "name": "Explicit CORS origin whitelisting without wildcard credentials",
      "status": "enforced",
      "severity": "high",
      "owasp": [
        "A02:2025"
      ],
      "cwe": [
        "CWE-942"
      ],
      "evidence": {
        "kind": "rule",
        "path": "rules/source/01-hono-framework-architecture.md"
      }
    },
    {
      "id": "SEC-03",
      "category": "HTTP Security & Header Hardening",
      "name": "Centralized error handling preventing internal stack trace disclosure",
      "status": "enforced",
      "severity": "medium",
      "owasp": [
        "A10:2025"
      ],
      "cwe": [
        "CWE-755"
      ],
      "evidence": {
        "kind": "rule",
        "path": "rules/source/01-hono-framework-architecture.md"
      }
    },
    {
      "id": "OPS-01",
      "category": "Container & CI Supply Chain Hardening",
      "name": "Container healthcheck probing /healthz returning HTTP 200 OK",
      "status": "enforced",
      "severity": "low",
      "owasp": [
        "A10:2025"
      ],
      "cwe": [
        "CWE-755"
      ],
      "evidence": {
        "kind": "endpoint",
        "path": "GET /healthz"
      }
    },
    {
      "id": "OPS-02",
      "category": "Container & CI Supply Chain Hardening",
      "name": "Non-root execution inside oven/bun:1.1-alpine (USER bun)",
      "status": "enforced",
      "severity": "high",
      "owasp": [
        "A02:2025"
      ],
      "cwe": [
        "CWE-250"
      ],
      "evidence": {
        "kind": "docker",
        "path": "starter/Dockerfile"
      }
    },
    {
      "id": "CI-01",
      "category": "Container & CI Supply Chain Hardening",
      "name": "Gitleaks secret detection and Semgrep AST scanning in CI",
      "status": "enforced",
      "severity": "critical",
      "owasp": [
        "A04:2025"
      ],
      "cwe": [
        "CWE-798"
      ],
      "evidence": {
        "kind": "workflow",
        "path": ".github/workflows/validate-kits.yml"
      }
    }
  ]
}
