{
  "$schema": "../../../schemas/kit-security-checks.schema.json",
  "schema_version": "2.0.0",
  "kit_slug": "django-tailwind-postgresql",
  "updated_at": "2026-10-24",
  "owasp_edition": "2025",
  "summary": {
    "total": 12,
    "categories": 1,
    "by_status": {
      "enforced": 12
    },
    "by_severity": {
      "critical": 2,
      "high": 6,
      "medium": 3,
      "low": 1
    },
    "owasp_covered": [
      "A02:2025",
      "A03:2025",
      "A04:2025",
      "A05:2025",
      "A06:2025",
      "A07:2025",
      "A08:2025"
    ]
  },
  "checks": [
    {
      "id": "SEC-01",
      "category": "Core Security Guardrails",
      "name": "Gitleaks Secret Audit",
      "status": "enforced",
      "severity": "critical",
      "owasp": [
        "A04:2025"
      ],
      "cwe": [
        "CWE-798"
      ],
      "evidence": {
        "kind": "tool",
        "path": "gitleaks"
      }
    },
    {
      "id": "SEC-02",
      "category": "Core Security Guardrails",
      "name": "Semgrep Python & Django Security Rules",
      "status": "enforced",
      "severity": "medium",
      "owasp": [
        "A03:2025"
      ],
      "cwe": [
        "CWE-1357"
      ],
      "evidence": {
        "kind": "tool",
        "path": "semgrep"
      }
    },
    {
      "id": "SEC-03",
      "category": "Core Security Guardrails",
      "name": "Django Deploy Security Audit",
      "status": "enforced",
      "severity": "high",
      "owasp": [
        "A02:2025"
      ],
      "cwe": [
        "CWE-16"
      ],
      "evidence": {
        "kind": "tool",
        "path": "manage.py"
      }
    },
    {
      "id": "SEC-04",
      "category": "Core Security Guardrails",
      "name": "CSRF Token Validation on All POST Forms",
      "status": "enforced",
      "severity": "high",
      "owasp": [
        "A06:2025"
      ],
      "cwe": [
        "CWE-352"
      ],
      "evidence": {
        "kind": "tool",
        "path": "test-runner"
      }
    },
    {
      "id": "SEC-05",
      "category": "Core Security Guardrails",
      "name": "PostgreSQL Parameterized ORM Queries",
      "status": "enforced",
      "severity": "critical",
      "owasp": [
        "A05:2025"
      ],
      "cwe": [
        "CWE-89"
      ],
      "evidence": {
        "kind": "tool",
        "path": "orm-lint"
      }
    },
    {
      "id": "SEC-06",
      "category": "Core Security Guardrails",
      "name": "WhiteNoise Manifest Static Hash Storage",
      "status": "enforced",
      "severity": "medium",
      "owasp": [
        "A08:2025"
      ],
      "cwe": [
        "CWE-345"
      ],
      "evidence": {
        "kind": "tool",
        "path": "whitenoise"
      }
    },
    {
      "id": "SEC-07",
      "category": "Core Security Guardrails",
      "name": "XSS Protection in Django Templates",
      "status": "enforced",
      "severity": "high",
      "owasp": [
        "A05:2025"
      ],
      "cwe": [
        "CWE-79"
      ],
      "evidence": {
        "kind": "tool",
        "path": "engine-check"
      }
    },
    {
      "id": "SEC-08",
      "category": "Core Security Guardrails",
      "name": "Clickjacking Defense (X-Frame-Options: DENY)",
      "status": "enforced",
      "severity": "medium",
      "owasp": [
        "A02:2025"
      ],
      "cwe": [
        "CWE-693"
      ],
      "evidence": {
        "kind": "tool",
        "path": "middleware-check"
      }
    },
    {
      "id": "SEC-09",
      "category": "Core Security Guardrails",
      "name": "Secure Session Cookie Flags (HttpOnly, Lax)",
      "status": "enforced",
      "severity": "high",
      "owasp": [
        "A07:2025"
      ],
      "cwe": [
        "CWE-1004"
      ],
      "evidence": {
        "kind": "tool",
        "path": "cookie-guard"
      }
    },
    {
      "id": "SEC-10",
      "category": "Core Security Guardrails",
      "name": "PostgreSQL Composite B-Tree Indexes",
      "status": "enforced",
      "severity": "low",
      "owasp": [
        "A06:2025"
      ],
      "cwe": [
        "CWE-1049"
      ],
      "evidence": {
        "kind": "tool",
        "path": "migration-lint"
      }
    },
    {
      "id": "SEC-11",
      "category": "Core Security Guardrails",
      "name": "Strict Password Validation Policies",
      "status": "enforced",
      "severity": "high",
      "owasp": [
        "A07:2025"
      ],
      "cwe": [
        "CWE-521"
      ],
      "evidence": {
        "kind": "tool",
        "path": "auth-check"
      }
    },
    {
      "id": "SEC-12",
      "category": "Core Security Guardrails",
      "name": "Safety CVE Dependency Check",
      "status": "enforced",
      "severity": "high",
      "owasp": [
        "A03:2025"
      ],
      "cwe": [
        "CWE-1104"
      ],
      "evidence": {
        "kind": "tool",
        "path": "pip-audit"
      }
    }
  ]
}
